{
  "id": "swinging_blade",
  "name": "Pendulum Blade",
  "description": "It keeps its own time. Learn the count or lose the arm.",
  "scene": "res://scenes/traps/swinging_blade.tscn",
  "trigger": "cycle",
  "telegraph": 0.5,
  "active": 0.35,
  "cooldown": 1.6,
  "triggerRadius": 3,
  "damage": 22,
  "poiseDamage": 22,
  "damageType": "physical",
  "hitInterval": 0.5,
  "statusId": "bleed",
  "statusBuildUp": 28,
  "enemyDamageMultiplier": 0.9,
  "size": [
    5,
    1.6,
    1.2
  ],
  "color": "#b9c2cc"
}
