{
  "id": "rot_censer",
  "name": "Rot Censer",
  "description": "It wakes for the dead first. Stand still and let them find it.",
  "scene": "res://scenes/traps/rot_censer.tscn",
  "trigger": "lure",
  "telegraph": 1.2,
  "active": 3,
  "cooldown": 5,
  "triggerRadius": 4,
  "damage": 5,
  "poiseDamage": 0,
  "damageType": "poison",
  "hitInterval": 0.8,
  "statusId": "poison",
  "statusBuildUp": 22,
  "enemyDamageMultiplier": 1.25,
  "size": [
    4.5,
    2.2,
    4.5
  ],
  "color": "#7fa05a"
}
